<?xml version="1.0" encoding="ISO_8859-1"?>
<!DOCTYPE root SYSTEM "Forecast.dtd">
<root>
<definition id="1" displayName="15MIN" initDaysPrior="7" timeIncrement="15" >
    <defElement elementID="1" initValueType="&INIT_TYPE_TREND;" rank="1" >
        <projection linkedProjElemID="1" linkedProjTimeFrame="&LINK_TIME_FRAME_DAY;" lockedToProj="N" />
        <linkedElement elementID="50" linkPercent="100" />
        <linkedElement elementID="51" linkPercent="100" />
        <linkedElement elementID="52" linkPercent="100" />
        <linkedElement elementID="53" linkPercent="100" />
        <linkedElement elementID="54" linkPercent="100" />
        <linkedElement elementID="55" linkPercent="100" />
        <linkedElement elementID="57" linkPercent="100" />
        <linkedElement elementID="58" linkPercent="100" />
        <elementGroup groupID="1" rank="1" />
    </defElement>
    <defElement elementID="50" initValueType="&INIT_TYPE_PATTERN;" rank="2" >
        <elementGroup groupID="1" rank="1" />
    </defElement>
    <defElement elementID="51" initValueType="&INIT_TYPE_PATTERN;" rank="3" >
        <elementGroup groupID="1" rank="1" />
    </defElement>
    <defElement elementID="52" initValueType="&INIT_TYPE_PATTERN;" rank="4" >
        <elementGroup groupID="1" rank="1" />
    </defElement>
    <defElement elementID="53" initValueType="&INIT_TYPE_PATTERN;" rank="5" >
        <elementGroup groupID="1" rank="1" />
    </defElement>
    <defElement elementID="54" initValueType="&INIT_TYPE_PATTERN;" rank="6" >
        <elementGroup groupID="1" rank="1" />
    </defElement>
    <defElement elementID="55" initValueType="&INIT_TYPE_PATTERN;" rank="7" >
        <elementGroup groupID="50" rank="1" />
        <elementGroup groupID="51" rank="2" />
        <elementGroup groupID="52" rank="3" />
        <elementGroup groupID="53" rank="4" />
        <elementGroup groupID="54" rank="5" />
        <elementGroup groupID="55" rank="6" />
        <elementGroup groupID="56" rank="7" />
        <elementGroup groupID="57" rank="8" />
        <elementGroup groupID="58" rank="9" />
        <elementGroup groupID="59" rank="10" />
        <elementGroup groupID="60" rank="11" />
        <elementGroup groupID="61" rank="12" />
        <elementGroup groupID="62" rank="13" />
        <elementGroup groupID="63" rank="14" />
        <elementGroup groupID="64" rank="15" />
        <elementGroup groupID="65" rank="16" />
        <elementGroup groupID="66" rank="17" />
        <elementGroup groupID="67" rank="18" />
        <elementGroup groupID="68" rank="19" />
        <elementGroup groupID="69" rank="20" />
        <elementGroup groupID="70" rank="21" />
        <elementGroup groupID="71" rank="22" />
        <elementGroup groupID="72" rank="23" />
        <elementGroup groupID="73" rank="24" />
        <elementGroup groupID="74" rank="25" />
        <elementGroup groupID="75" rank="26" />
        <elementGroup groupID="76" rank="27" />
        <elementGroup groupID="77" rank="28" />
        <elementGroup groupID="78" rank="29" />
        <elementGroup groupID="79" rank="30" />
        <elementGroup groupID="80" rank="31" />
        <elementGroup groupID="81" rank="32" />
        <elementGroup groupID="82" rank="33" />
        <elementGroup groupID="83" rank="34" />
        <elementGroup groupID="84" rank="35" />
        <elementGroup groupID="85" rank="36" />
        <elementGroup groupID="86" rank="37" />
        <elementGroup groupID="87" rank="38" />
        <elementGroup groupID="88" rank="39" />
        <elementGroup groupID="89" rank="40" />
        <elementGroup groupID="90" rank="41" />
        <elementGroup groupID="91" rank="42" />
        <elementGroup groupID="92" rank="43" />
        <elementGroup groupID="93" rank="44" />
        <elementGroup groupID="94" rank="45" />
        <elementGroup groupID="95" rank="46" />
        <elementGroup groupID="96" rank="47" />
        <elementGroup groupID="97" rank="48" />
        <elementGroup groupID="98" rank="49" />
        <elementGroup groupID="99" rank="50" />
        <elementGroup groupID="100" rank="51" />
        <elementGroup groupID="101" rank="52" />
        <elementGroup groupID="102" rank="53" />
        <elementGroup groupID="103" rank="54" />
        <elementGroup groupID="104" rank="55" />
        <elementGroup groupID="105" rank="56" />
        <elementGroup groupID="106" rank="57" />
        <elementGroup groupID="107" rank="58" />
        <elementGroup groupID="108" rank="59" />
        <elementGroup groupID="109" rank="60" />
        <elementGroup groupID="110" rank="61" />
        <elementGroup groupID="111" rank="62" />
        <elementGroup groupID="112" rank="63" />
        <elementGroup groupID="113" rank="64" />
        <elementGroup groupID="114" rank="65" />
        <elementGroup groupID="115" rank="66" />
        <elementGroup groupID="116" rank="67" />
        <elementGroup groupID="117" rank="68" />
        <elementGroup groupID="118" rank="69" />
        <elementGroup groupID="119" rank="70" />
        <elementGroup groupID="120" rank="71" />
        <elementGroup groupID="121" rank="72" />
        <elementGroup groupID="122" rank="73" />
        <elementGroup groupID="123" rank="74" />
        <elementGroup groupID="124" rank="75" />
        <elementGroup groupID="125" rank="76" />
        <elementGroup groupID="126" rank="77" />
        <elementGroup groupID="127" rank="78" />
        <elementGroup groupID="128" rank="79" />
        <elementGroup groupID="129" rank="80" />
        <elementGroup groupID="130" rank="81" />
        <elementGroup groupID="131" rank="82" />
        <elementGroup groupID="132" rank="83" />
        <elementGroup groupID="133" rank="84" />
        <elementGroup groupID="134" rank="85" />
        <elementGroup groupID="135" rank="86" />
        <elementGroup groupID="136" rank="87" />
        <elementGroup groupID="137" rank="88" />
        <elementGroup groupID="138" rank="89" />
    </defElement>
    <defElement elementID="57" initValueType="&INIT_TYPE_PATTERN;" rank="8" >
        <elementGroup groupID="1" rank="1" />
    </defElement>
    <defElement elementID="58" initValueType="&INIT_TYPE_PATTERN;" rank="9" >
        <elementGroup groupID="50" rank="1" />
        <elementGroup groupID="51" rank="2" />
        <elementGroup groupID="52" rank="3" />
        <elementGroup groupID="53" rank="4" />
        <elementGroup groupID="54" rank="5" />
        <elementGroup groupID="55" rank="6" />
        <elementGroup groupID="56" rank="7" />
        <elementGroup groupID="57" rank="8" />
        <elementGroup groupID="58" rank="9" />
        <elementGroup groupID="59" rank="10" />
        <elementGroup groupID="60" rank="11" />
        <elementGroup groupID="61" rank="12" />
        <elementGroup groupID="62" rank="13" />
        <elementGroup groupID="63" rank="14" />
        <elementGroup groupID="64" rank="15" />
        <elementGroup groupID="65" rank="16" />
        <elementGroup groupID="66" rank="17" />
        <elementGroup groupID="67" rank="18" />
        <elementGroup groupID="68" rank="19" />
        <elementGroup groupID="69" rank="20" />
        <elementGroup groupID="70" rank="21" />
        <elementGroup groupID="71" rank="22" />
        <elementGroup groupID="72" rank="23" />
        <elementGroup groupID="73" rank="24" />
        <elementGroup groupID="74" rank="25" />
        <elementGroup groupID="75" rank="26" />
        <elementGroup groupID="76" rank="27" />
        <elementGroup groupID="77" rank="28" />
        <elementGroup groupID="78" rank="29" />
        <elementGroup groupID="79" rank="30" />
        <elementGroup groupID="80" rank="31" />
        <elementGroup groupID="81" rank="32" />
        <elementGroup groupID="82" rank="33" />
        <elementGroup groupID="83" rank="34" />
        <elementGroup groupID="84" rank="35" />
        <elementGroup groupID="85" rank="36" />
        <elementGroup groupID="86" rank="37" />
        <elementGroup groupID="87" rank="38" />
        <elementGroup groupID="88" rank="39" />
        <elementGroup groupID="89" rank="40" />
        <elementGroup groupID="90" rank="41" />
        <elementGroup groupID="91" rank="42" />
        <elementGroup groupID="92" rank="43" />
        <elementGroup groupID="93" rank="44" />
        <elementGroup groupID="94" rank="45" />
        <elementGroup groupID="95" rank="46" />
        <elementGroup groupID="96" rank="47" />
        <elementGroup groupID="97" rank="48" />
        <elementGroup groupID="98" rank="49" />
        <elementGroup groupID="99" rank="50" />
        <elementGroup groupID="100" rank="51" />
        <elementGroup groupID="101" rank="52" />
        <elementGroup groupID="102" rank="53" />
        <elementGroup groupID="103" rank="54" />
        <elementGroup groupID="104" rank="55" />
        <elementGroup groupID="105" rank="56" />
        <elementGroup groupID="106" rank="57" />
        <elementGroup groupID="107" rank="58" />
        <elementGroup groupID="108" rank="59" />
        <elementGroup groupID="109" rank="60" />
        <elementGroup groupID="110" rank="61" />
        <elementGroup groupID="111" rank="62" />
        <elementGroup groupID="112" rank="63" />
        <elementGroup groupID="113" rank="64" />
        <elementGroup groupID="114" rank="65" />
        <elementGroup groupID="115" rank="66" />
        <elementGroup groupID="116" rank="67" />
        <elementGroup groupID="117" rank="68" />
        <elementGroup groupID="118" rank="69" />
        <elementGroup groupID="119" rank="70" />
        <elementGroup groupID="120" rank="71" />
        <elementGroup groupID="121" rank="72" />
        <elementGroup groupID="122" rank="73" />
        <elementGroup groupID="123" rank="74" />